{"atlas_screen_id":null,"blueprint_id":"BP-GEN-MI-SHOP-EXAMPLE-001","dimensions":{"coordinate_system":"atlas_tile","height":11,"origin":"top_left","unit":"tile","width":15},"event_anchors":[{"anchor":{"shape":"point","x":5,"y":9},"local_anchor_id":"GEN-npc_service_point-service_point","trigger_intent":"npc_service_point"}],"generation_manifest_ref":"GEN-WO0059-FIXTURE-SHOP-OFFSET-002","landmark_slots":[{"anchor":{"shape":"point","x":7,"y":9},"dominant":true,"landmark_tag":"floor_rug_focal_accent","required":true,"zone_id":"focal_feature","zone_role":"focal_feature"}],"map_intent":{"archetype_ref":"ARCH-INTERIOR-SHOP@1.0","critical_path_role":"optional_non_critical","generation_seed":7914783948955692791,"layout_family_ref":"LAY-INTERIOR-SHOP-OFFSET@1.0","layout_mode":"procedural","purpose":"Illustrate the WO-0056 contract end to end for a single-room retail interior, per PAT-INTERIOR-SHOP. Not bound to a canonical Atlas screen; a real build would set atlas_screen_id to the target SCR-* id.","reflected":true,"rotation":0,"variant_id":"l_extension_right"},"obstacles":[{"area":{"h":1,"shape":"rect","w":4,"x":7,"y":7},"blocking":true,"clearance":1,"module_ref":"MOD-SHELF-WALL-RUN","name":"shelf_wall_run","obstacle_id":"mod-shelf-wall-run-1","parent_zone":"wall_stock"}],"schema_version":"0.1","source_documents":["studio/design-patterns/interiors/shop.pattern.md","atlas-tools/mapgen/blueprint_schema.md"],"terrain":[{"area":{"h":2,"shape":"rect","w":2,"x":8,"y":9},"movement":"walkable","terrain_id":"ZONE-center_aisle","terrain_type":"center_aisle"},{"area":{"h":1,"shape":"rect","w":1,"x":7,"y":10},"movement":"walkable","terrain_id":"ZONE-entry_threshold","terrain_type":"entry_threshold"},{"area":{"h":1,"shape":"rect","w":2,"x":6,"y":9},"movement":"walkable","terrain_id":"ZONE-focal_feature","terrain_type":"focal_feature"},{"area":{"h":1,"shape":"rect","w":2,"x":4,"y":9},"movement":"walkable","terrain_id":"ZONE-service_point","terrain_type":"service_point"},{"area":{"h":2,"shape":"rect","w":4,"x":7,"y":7},"movement":"walkable","terrain_id":"ZONE-wall_stock","terrain_type":"wall_stock"}],"title":"Generic Small Retail Shop Interior (Contract Example) - generated structural candidate","transfer_points":[{"anchor":{"shape":"point","x":7,"y":10},"placement_intent":"exit_transfer","transfer_id":"GEN-exit_transfer-entry_threshold"}],"traversable_areas":[{"area_id":"EDGE-1","connector_type":"open_floor","from_zone":"entry_threshold","required":true,"to_zone":"center_aisle"},{"area_id":"EDGE-2","connector_type":"open_floor","from_zone":"center_aisle","required":true,"to_zone":"wall_stock"},{"area_id":"EDGE-3","connector_type":"open_floor","from_zone":"center_aisle","required":true,"to_zone":"focal_feature"},{"area_id":"EDGE-4","connector_type":"open_floor","from_zone":"focal_feature","required":false,"to_zone":"service_point"}],"validation":{"assembly_attempts":9,"assembly_budget":{"max_attempts":5000,"max_depth":20},"entry_zone":"entry_threshold","must_reach":["center_aisle","wall_stock","focal_feature"]}}
