{"atlas_screen_id":null,"blueprint_id":"BP-GEN-MI-INN-EXAMPLE-001","dimensions":{"coordinate_system":"atlas_tile","height":13,"origin":"top_left","unit":"tile","width":16},"event_anchors":[{"anchor":{"shape":"point","x":6,"y":2},"local_anchor_id":"GEN-npc_service_point-service_point","trigger_intent":"npc_service_point"}],"generation_manifest_ref":"GEN-WO0059-FIXTURE-INN-COMPACT-002","landmark_slots":[{"anchor":{"shape":"point","x":9,"y":2},"dominant":false,"landmark_tag":"wall_mounted_flame","required":false,"zone_id":"common_room","zone_role":"common_room"}],"map_intent":{"archetype_ref":"ARCH-INTERIOR-INN@1.0","critical_path_role":"optional_non_critical","generation_seed":12503086781493307206,"layout_family_ref":"LAY-INTERIOR-INN-COMPACT@1.0","layout_mode":"procedural","purpose":"Illustrate the WO-0056 contract end to end for a two-zone lodging interior (common room + guest quarters wing), per PAT-INTERIOR-INN. Not bound to a canonical Atlas screen; a real build would set atlas_screen_id to the target SCR-* id.","reflected":false,"rotation":180,"variant_id":"single_wing_column"},"obstacles":[{"area":{"h":3,"shape":"rect","w":2,"x":12,"y":4},"blocking":true,"clearance":1,"module_ref":"MOD-BED-DESK-NOOK","name":"bed_desk_nook","obstacle_id":"mod-bed-desk-nook-1","parent_zone":"guest_quarters_wing"},{"area":{"h":3,"shape":"rect","w":2,"x":10,"y":4},"blocking":true,"clearance":1,"module_ref":"MOD-BED-DESK-NOOK","name":"bed_desk_nook","obstacle_id":"mod-bed-desk-nook-2","parent_zone":"guest_quarters_wing"}],"schema_version":"0.1","source_documents":["studio/design-patterns/interiors/inn.pattern.md","atlas-tools/mapgen/blueprint_schema.md"],"terrain":[{"area":{"h":3,"shape":"rect","w":4,"x":7,"y":1},"movement":"walkable","terrain_id":"ZONE-common_room","terrain_type":"common_room"},{"area":{"h":3,"shape":"rect","w":4,"x":10,"y":4},"movement":"walkable","terrain_id":"ZONE-guest_quarters_wing","terrain_type":"guest_quarters_wing"},{"area":{"h":1,"shape":"rect","w":2,"x":5,"y":2},"movement":"walkable","terrain_id":"ZONE-service_point","terrain_type":"service_point"},{"area":{"h":2,"shape":"rect","w":2,"x":11,"y":2},"movement":"walkable","terrain_id":"ZONE-spine_corridor","terrain_type":"spine_corridor"},{"area":{"h":1,"shape":"rect","w":1,"x":8,"y":0},"movement":"walkable","terrain_id":"ZONE-vestibule_alcove","terrain_type":"vestibule_alcove"}],"title":"Generic Two-Zone Lodging Interior (Contract Example) - generated structural candidate","transfer_points":[{"anchor":{"shape":"point","x":8,"y":0},"placement_intent":"exit_transfer","transfer_id":"GEN-exit_transfer-vestibule_alcove"}],"traversable_areas":[{"area_id":"EDGE-1","connector_type":"chokepoint_corridor","from_zone":"vestibule_alcove","required":true,"to_zone":"common_room"},{"area_id":"EDGE-2","connector_type":"chokepoint_corridor","from_zone":"common_room","required":true,"to_zone":"spine_corridor"},{"area_id":"EDGE-3","connector_type":"open_floor","from_zone":"spine_corridor","required":true,"to_zone":"guest_quarters_wing"},{"area_id":"EDGE-4","connector_type":"open_floor","from_zone":"common_room","required":false,"to_zone":"service_point"}],"validation":{"assembly_attempts":8,"assembly_budget":{"max_attempts":5000,"max_depth":20},"entry_zone":"vestibule_alcove","must_reach":["common_room","spine_corridor","guest_quarters_wing"]}}
