{"atlas_screen_id":null,"blueprint_id":"BP-GEN-MI-ASHFORD-EXAMPLE-001","dimensions":{"coordinate_system":"atlas_tile","height":26,"origin":"top_left","unit":"tile","width":30},"event_anchors":[],"generation_manifest_ref":"GEN-WO0071-FIXTURE-CORE-002","landmark_slots":[{"anchor":{"shape":"point","x":15,"y":15},"dominant":true,"landmark_tag":"central_well","required":true,"tile_assembly_building_height_rows":null,"tile_assembly_height":2,"tile_assembly_ref":"ASH-CUSTOM-WELL-ROOFED-01","tile_assembly_review_state":"human_approved","tile_assembly_source_kit":"ASHFORD-CUSTOM-TILESET-EXTENSION-001","tile_assembly_width":2,"zone_id":"well_square","zone_role":"well_square"},{"anchor":{"shape":"point","x":15,"y":23},"dominant":false,"landmark_tag":"warm_vent","required":true,"tile_assembly_building_height_rows":null,"tile_assembly_height":2,"tile_assembly_ref":"TASM-ASHFORD-WARM-VENT-AUTHORED","tile_assembly_review_state":"human_approved","tile_assembly_source_kit":"TASM-KIT-ASHFORD-AUTHORED-001","tile_assembly_width":3,"zone_id":"arrival_domestic","zone_role":"arrival_domestic"},{"anchor":{"shape":"point","x":15,"y":23},"dominant":false,"landmark_tag":"humming_panel","required":true,"tile_assembly_building_height_rows":null,"tile_assembly_height":2,"tile_assembly_ref":"ASH-CUSTOM-PANEL-01","tile_assembly_review_state":"human_approved","tile_assembly_source_kit":"ASHFORD-CUSTOM-TILESET-EXTENSION-001","tile_assembly_width":1,"zone_id":"arrival_domestic","zone_role":"arrival_domestic"}],"map_intent":{"archetype_ref":"ARCH-EXTERIOR-SETTLEMENT-COMPACT@1.0","critical_path_role":"optional_non_critical","generation_seed":5762162206053234304,"layout_family_ref":"LAY-EXTERIOR-SETTLEMENT-ASHFORD-ORGANIC@1.0","layout_mode":"procedural","purpose":"Disposable WO-0071 compiler-integration fixture proving MapVision and TileAssembly resolution end to end for a compact exterior settlement archetype. Not the production MI-HOM-ASH-001 and authorizes no production map write.","reflected":true,"rotation":0,"variant_id":"organic_wide"},"obstacles":[{"area":{"h":5,"shape":"rect","w":6,"x":12,"y":21},"blocking":true,"clearance":1,"module_ref":"MOD-ELARA-HOUSE","name":"elara_house","obstacle_id":"mod-elara-house-1","parent_zone":"arrival_domestic","tile_assembly_building_height_rows":4,"tile_assembly_height":5,"tile_assembly_ref":"TASM-ASHFORD-ELARA-HOUSE-AUTHORED","tile_assembly_review_state":"human_approved","tile_assembly_source_kit":"TASM-KIT-ASHFORD-AUTHORED-001","tile_assembly_width":6},{"area":{"h":6,"shape":"rect","w":7,"x":12,"y":3},"blocking":true,"clearance":1,"module_ref":"MOD-ASHFORD-SHOP","name":"ashford_shop","obstacle_id":"mod-ashford-shop-1","parent_zone":"shop_frontage","tile_assembly_building_height_rows":5,"tile_assembly_height":6,"tile_assembly_ref":"TASM-ASHFORD-SHOP-AUTHORED","tile_assembly_review_state":"human_approved_with_revision","tile_assembly_source_kit":"TASM-KIT-ASHFORD-AUTHORED-001","tile_assembly_width":7},{"area":{"h":6,"shape":"rect","w":9,"x":21,"y":12},"blocking":true,"clearance":1,"module_ref":"MOD-ASHFORD-INN","name":"ashford_inn","obstacle_id":"mod-ashford-inn-1","parent_zone":"inn_frontage","tile_assembly_building_height_rows":5,"tile_assembly_height":6,"tile_assembly_ref":"TASM-ASHFORD-INN-AUTHORED","tile_assembly_review_state":"human_approved_with_revision","tile_assembly_source_kit":"TASM-KIT-ASHFORD-AUTHORED-001","tile_assembly_width":9},{"area":{"h":5,"shape":"rect","w":7,"x":2,"y":12},"blocking":true,"clearance":1,"module_ref":"MOD-ASHFORD-ELDER-HOUSE","name":"ashford_elder_house","obstacle_id":"mod-ashford-elder-house-1","parent_zone":"elder_frontage","tile_assembly_building_height_rows":4,"tile_assembly_height":5,"tile_assembly_ref":"TASM-ASHFORD-ELDER-HOUSE-AUTHORED","tile_assembly_review_state":"human_approved","tile_assembly_source_kit":"TASM-KIT-ASHFORD-AUTHORED-001","tile_assembly_width":7}],"schema_version":"0.1","source_documents":["atlas-tools/mapgen/compiler/contract/MapVision_Contract.md","atlas-tools/mapgen/tile_assembly/kits/ashford/README.md"],"terrain":[{"area":{"h":5,"shape":"rect","w":6,"x":12,"y":21},"movement":"walkable","terrain_id":"ZONE-arrival_domestic","terrain_type":"arrival_domestic"},{"area":{"h":5,"shape":"rect","w":7,"x":2,"y":12},"movement":"walkable","terrain_id":"ZONE-elder_frontage","terrain_type":"elder_frontage"},{"area":{"h":6,"shape":"rect","w":9,"x":21,"y":12},"movement":"walkable","terrain_id":"ZONE-inn_frontage","terrain_type":"inn_frontage"},{"area":{"h":1,"shape":"rect","w":2,"x":15,"y":2},"movement":"walkable","terrain_id":"ZONE-route_mouth","terrain_type":"route_mouth"},{"area":{"h":6,"shape":"rect","w":7,"x":12,"y":3},"movement":"walkable","terrain_id":"ZONE-shop_frontage","terrain_type":"shop_frontage"},{"area":{"h":12,"shape":"rect","w":12,"x":9,"y":9},"movement":"walkable","terrain_id":"ZONE-well_square","terrain_type":"well_square"}],"title":"Ashford Exterior Compact Settlement (Contract Example) - generated structural candidate","transfer_points":[{"anchor":{"shape":"point","x":16,"y":2},"placement_intent":"exit_transfer","transfer_id":"GEN-exit_transfer-route_mouth"}],"traversable_areas":[{"area_id":"EDGE-1","connector_type":"open_floor","from_zone":"arrival_domestic","required":true,"to_zone":"well_square"},{"area_id":"EDGE-2","connector_type":"road_connection","from_zone":"well_square","required":true,"to_zone":"shop_frontage"},{"area_id":"EDGE-3","connector_type":"road_connection","from_zone":"well_square","required":true,"to_zone":"inn_frontage"},{"area_id":"EDGE-4","connector_type":"road_connection","from_zone":"well_square","required":true,"to_zone":"elder_frontage"},{"area_id":"EDGE-5","connector_type":"road_connection","from_zone":"shop_frontage","required":true,"to_zone":"route_mouth"}],"validation":{"assembly_attempts":15,"assembly_budget":{"max_attempts":5000,"max_depth":20},"entry_zone":"arrival_domestic","must_reach":["well_square","shop_frontage","inn_frontage","elder_frontage","route_mouth"]}}
