{"atlas_screen_id":null,"blueprint_id":"BP-GEN-MI-HOUSE-EXAMPLE-001","dimensions":{"coordinate_system":"atlas_tile","height":13,"origin":"top_left","unit":"tile","width":17},"event_anchors":[],"generation_manifest_ref":"GEN-WO0059-FIXTURE-HOUSE-OFFSET-001","landmark_slots":[{"anchor":{"shape":"point","x":8,"y":7},"dominant":true,"landmark_tag":"shelf_wall_run","required":true,"zone_id":"wall_stock","zone_role":"wall_stock"}],"map_intent":{"archetype_ref":"ARCH-INTERIOR-HOUSE@1.0","critical_path_role":"optional_non_critical","generation_seed":16499788695352105453,"layout_family_ref":"LAY-INTERIOR-HOUSE-OFFSET@1.0","layout_mode":"procedural","purpose":"Illustrate the WO-0059 archetype kit end to end for a small domestic house interior, per PAT-INTERIOR-HOUSE. Not bound to a canonical Atlas screen; a real build would set atlas_screen_id to the target SCR-* id.","reflected":false,"rotation":0,"variant_id":"accent_offset_right"},"obstacles":[{"area":{"h":1,"shape":"rect","w":8,"x":4,"y":6},"blocking":true,"clearance":1,"module_ref":"MOD-BACK-WALL-SHELF-RUN","name":"back_wall_shelf_run","obstacle_id":"mod-back-wall-shelf-run-1","parent_zone":"wall_stock"}],"schema_version":"0.1","source_documents":["studio/design-patterns/interiors/house.pattern.md","atlas-tools/mapgen/blueprint_schema.md"],"terrain":[{"area":{"h":1,"shape":"rect","w":1,"x":8,"y":12},"movement":"walkable","terrain_id":"ZONE-entry_threshold","terrain_type":"entry_threshold"},{"area":{"h":3,"shape":"rect","w":4,"x":6,"y":9},"movement":"walkable","terrain_id":"ZONE-main_floor","terrain_type":"main_floor"},{"area":{"h":3,"shape":"rect","w":8,"x":4,"y":6},"movement":"walkable","terrain_id":"ZONE-wall_stock","terrain_type":"wall_stock"}],"title":"Generic Single-Room Domestic House Interior (Contract Example) - generated structural candidate","transfer_points":[{"anchor":{"shape":"point","x":8,"y":12},"placement_intent":"exit_transfer","transfer_id":"GEN-exit_transfer-entry_threshold"}],"traversable_areas":[{"area_id":"EDGE-1","connector_type":"open_floor","from_zone":"entry_threshold","required":true,"to_zone":"main_floor"},{"area_id":"EDGE-2","connector_type":"open_floor","from_zone":"main_floor","required":true,"to_zone":"wall_stock"}],"validation":{"assembly_attempts":5,"assembly_budget":{"max_attempts":5000,"max_depth":20},"entry_zone":"entry_threshold","must_reach":["main_floor","wall_stock"]}}
